[2025-06-16 17:39:53.486037] Ether / IP / TCP 10.0.2.15:38364 > 104.208.16.91:https S
[2025-06-16 17:39:53.551032] Ether / IP / TCP 104.208.16.91:https > 10.0.2.15:38364 SA / Padding
[2025-06-16 17:39:53.551903] Ether / IP / TCP 10.0.2.15:38364 > 104.208.16.91:https A
[2025-06-16 17:39:53.552657] Ether / IP / TCP 10.0.2.15:38364 > 104.208.16.91:https PA / Raw
[2025-06-16 17:39:53.553214] Ether / IP / TCP 104.208.16.91:https > 10.0.2.15:38364 A / Padding
[2025-06-16 17:39:53.612425] Ether / IP / TCP 104.208.16.91:https > 10.0.2.15:38364 PA / Raw
[2025-06-16 17:39:53.613155] Ether / IP / TCP 10.0.2.15:38364 > 104.208.16.91:https A
[2025-06-16 17:39:53.613739] Ether / IP / TCP 10.0.2.15:38364 > 104.208.16.91:https PA / Raw
[2025-06-16 17:39:53.614354] Ether / IP / TCP 104.208.16.91:https > 10.0.2.15:38364 A / Padding
[2025-06-16 17:39:53.672834] Ether / IP / TCP 104.208.16.91:https > 10.0.2.15:38364 A / Raw
[2025-06-16 17:39:53.673275] Ether / IP / TCP 104.208.16.91:https > 10.0.2.15:38364 PA / Raw
[2025-06-16 17:39:53.673654] Ether / IP / TCP 104.208.16.91:https > 10.0.2.15:38364 A / Raw
[2025-06-16 17:39:53.674005] Ether / IP / TCP 10.0.2.15:38364 > 104.208.16.91:https A
[2025-06-16 17:39:53.674320] Ether / IP / TCP 10.0.2.15:38364 > 104.208.16.91:https A
[2025-06-16 17:39:53.674724] Ether / IP / TCP 104.208.16.91:https > 10.0.2.15:38364 PA / Raw
[2025-06-16 17:39:53.675098] Ether / IP / TCP 10.0.2.15:38364 > 104.208.16.91:https PA / Raw
[2025-06-16 17:39:53.675831] Ether / IP / TCP 104.208.16.91:https > 10.0.2.15:38364 A / Padding
[2025-06-16 17:39:53.676183] Ether / IP / TCP 104.208.16.91:https > 10.0.2.15:38364 A / Padding
[2025-06-16 17:39:53.676534] Ether / IP / TCP 104.208.16.91:https > 10.0.2.15:38364 A / Padding
[2025-06-16 17:39:53.739086] Ether / IP / TCP 104.208.16.91:https > 10.0.2.15:38364 PA / Raw
[2025-06-16 17:39:53.740225] Ether / IP / TCP 104.208.16.91:https > 10.0.2.15:38364 PA / Raw
[2025-06-16 17:39:53.740625] Ether / IP / TCP 104.208.16.91:https > 10.0.2.15:38364 FA / Padding
[2025-06-16 17:39:53.740955] Ether / IP / TCP 10.0.2.15:38364 > 104.208.16.91:https A
[2025-06-16 17:39:53.741489] Ether / IP / TCP 10.0.2.15:38364 > 104.208.16.91:https PA / Raw
[2025-06-16 17:39:53.741923] Ether / IP / TCP 104.208.16.91:https > 10.0.2.15:38364 A / Padding
[2025-06-16 17:39:53.742239] Ether / IP / TCP 10.0.2.15:38364 > 104.208.16.91:https FA
[2025-06-16 17:39:53.743219] Ether / IP / TCP 104.208.16.91:https > 10.0.2.15:38364 A / Padding
[2025-06-16 17:44:08.757500] Ether / ARP who has 10.0.2.3 says 10.0.2.15
[2025-06-16 17:44:08.758043] Ether / ARP is at 52:55:0a:00:02:03 says 10.0.2.3 / Padding
